"No.","Time","Source","Destination","Protocol","Length","Info"
"1","0.000000","e6:be:5e:ce:2e:a4","","ARP","48","Who has 172.18.0.2? Tell 172.18.0.3"
"2","0.000048","e6:be:5e:ce:2e:a4","","ARP","48","Who has 172.18.0.2? Tell 172.18.0.3"
"3","0.000121","ca:fe:b4:06:10:0a","","ARP","48","172.18.0.2 is at ca:fe:b4:06:10:0a"
"4","0.010164","172.18.0.3","172.18.0.2","TCP","80","54642  >  5000 [SYN] Seq=0 Win=64240 Len=0 MSS=1460 SACK_PERM TSval=2273622827 TSecr=0 WS=128"
"5","0.010330","172.18.0.2","172.18.0.3","TCP","80","5000  >  54642 [SYN, ACK] Seq=0 Ack=1 Win=65160 Len=0 MSS=1460 SACK_PERM TSval=1826898938 TSecr=2273622827 WS=128"
"6","0.020413","172.18.0.3","172.18.0.2","TCP","72","54642  >  5000 [ACK] Seq=1 Ack=1 Win=64256 Len=0 TSval=2273622848 TSecr=1826898938"
"7","0.023600","172.18.0.3","172.18.0.2","TCP","2968","54642  >  5000 [PSH, ACK] Seq=1 Ack=1 Win=64256 Len=2896 TSval=2273622851 TSecr=1826898938"
"8","0.023605","172.18.0.3","172.18.0.2","TCP","1272","54642  >  5000 [PSH, ACK] Seq=2897 Ack=1 Win=64256 Len=1200 TSval=2273622851 TSecr=1826898938"
"9","0.023607","172.18.0.3","172.18.0.2","TCP","2968","54642  >  5000 [PSH, ACK] Seq=4097 Ack=1 Win=64256 Len=2896 TSval=2273622851 TSecr=1826898938"
"10","0.023609","172.18.0.3","172.18.0.2","TCP","2968","54642  >  5000 [PSH, ACK] Seq=6993 Ack=1 Win=64256 Len=2896 TSval=2273622851 TSecr=1826898938"
"11","0.023610","172.18.0.3","172.18.0.2","TCP","1520","54642  >  5000 [ACK] Seq=9889 Ack=1 Win=64256 Len=1448 TSval=2273622851 TSecr=1826898938"
"12","0.023613","172.18.0.3","172.18.0.2","TCP","2968","54642  >  5000 [PSH, ACK] Seq=11337 Ack=1 Win=64256 Len=2896 TSval=2273622851 TSecr=1826898938"
"13","0.023769","172.18.0.2","172.18.0.3","TCP","72","5000  >  54642 [ACK] Seq=1 Ack=2897 Win=71040 Len=0 TSval=1826898951 TSecr=2273622851"
"14","0.023799","172.18.0.2","172.18.0.3","TCP","72","5000  >  54642 [ACK] Seq=1 Ack=4097 Win=73856 Len=0 TSval=1826898951 TSecr=2273622851"
"15","0.023809","172.18.0.2","172.18.0.3","TCP","72","5000  >  54642 [ACK] Seq=1 Ack=6993 Win=79744 Len=0 TSval=1826898951 TSecr=2273622851"
"16","0.023823","172.18.0.2","172.18.0.3","TCP","72","5000  >  54642 [ACK] Seq=1 Ack=9889 Win=85504 Len=0 TSval=1826898951 TSecr=2273622851"
"17","0.023841","172.18.0.2","172.18.0.3","TCP","72","5000  >  54642 [ACK] Seq=1 Ack=11337 Win=87808 Len=0 TSval=1826898951 TSecr=2273622851"
"18","0.023851","172.18.0.2","172.18.0.3","TCP","72","5000  >  54642 [ACK] Seq=1 Ack=14233 Win=84992 Len=0 TSval=1826898951 TSecr=2273622851"
"19","0.033848","172.18.0.3","172.18.0.2","TCP","2968","54642  >  5000 [PSH, ACK] Seq=14233 Ack=1 Win=64256 Len=2896 TSval=2273622861 TSecr=1826898951"
"20","0.033861","172.18.0.3","172.18.0.2","TCP","2968","54642  >  5000 [PSH, ACK] Seq=17129 Ack=1 Win=64256 Len=2896 TSval=2273622861 TSecr=1826898951"
"21","0.033863","172.18.0.3","172.18.0.2","TCP","2968","54642  >  5000 [PSH, ACK] Seq=20025 Ack=1 Win=64256 Len=2896 TSval=2273622861 TSecr=1826898951"
"22","0.033865","172.18.0.3","172.18.0.2","TCP","2968","54642  >  5000 [PSH, ACK] Seq=22921 Ack=1 Win=64256 Len=2896 TSval=2273622861 TSecr=1826898951"
"23","0.033867","172.18.0.3","172.18.0.2","TCP","2968","54642  >  5000 [PSH, ACK] Seq=25817 Ack=1 Win=64256 Len=2896 TSval=2273622861 TSecr=1826898951"
"24","0.033869","172.18.0.3","172.18.0.2","TCP","2968","54642  >  5000 [PSH, ACK] Seq=28713 Ack=1 Win=64256 Len=2896 TSval=2273622861 TSecr=1826898951"
"25","0.033871","172.18.0.3","172.18.0.2","TCP","2968","54642  >  5000 [PSH, ACK] Seq=31609 Ack=1 Win=64256 Len=2896 TSval=2273622861 TSecr=1826898951"
"26","0.033874","172.18.0.3","172.18.0.2","TCP","2968","54642  >  5000 [PSH, ACK] Seq=34505 Ack=1 Win=64256 Len=2896 TSval=2273622861 TSecr=1826898951"
"27","0.033876","172.18.0.3","172.18.0.2","TCP","2968","54642  >  5000 [PSH, ACK] Seq=37401 Ack=1 Win=64256 Len=2896 TSval=2273622861 TSecr=1826898951"
"28","0.033878","172.18.0.3","172.18.0.2","TCP","2968","54642  >  5000 [PSH, ACK] Seq=40297 Ack=1 Win=64256 Len=2896 TSval=2273622861 TSecr=1826898951"
"29","0.034080","172.18.0.2","172.18.0.3","TCP","72","5000  >  54642 [ACK] Seq=1 Ack=17129 Win=93696 Len=0 TSval=1826898961 TSecr=2273622861"
"30","0.034082","172.18.0.2","172.18.0.3","TCP","72","5000  >  54642 [ACK] Seq=1 Ack=22921 Win=91264 Len=0 TSval=1826898961 TSecr=2273622861"
"31","0.034107","172.18.0.2","172.18.0.3","TCP","72","5000  >  54642 [ACK] Seq=1 Ack=20025 Win=94080 Len=0 TSval=1826898961 TSecr=2273622861"
"32","0.034143","172.18.0.2","172.18.0.3","TCP","72","5000  >  54642 [ACK] Seq=1 Ack=25817 Win=88448 Len=0 TSval=1826898961 TSecr=2273622861"
"33","0.034167","172.18.0.2","172.18.0.3","TCP","72","5000  >  54642 [ACK] Seq=1 Ack=28713 Win=85632 Len=0 TSval=1826898961 TSecr=2273622861"
"34","0.034189","172.18.0.2","172.18.0.3","TCP","72","5000  >  54642 [ACK] Seq=1 Ack=31609 Win=82816 Len=0 TSval=1826898961 TSecr=2273622861"
"35","0.034209","172.18.0.2","172.18.0.3","TCP","72","5000  >  54642 [ACK] Seq=1 Ack=34505 Win=80000 Len=0 TSval=1826898961 TSecr=2273622861"
"36","0.034231","172.18.0.2","172.18.0.3","TCP","72","5000  >  54642 [ACK] Seq=1 Ack=37401 Win=77184 Len=0 TSval=1826898961 TSecr=2273622861"
"37","0.034252","172.18.0.2","172.18.0.3","TCP","72","5000  >  54642 [ACK] Seq=1 Ack=40297 Win=74368 Len=0 TSval=1826898961 TSecr=2273622861"
"38","0.034273","172.18.0.2","172.18.0.3","TCP","72","5000  >  54642 [ACK] Seq=1 Ack=43193 Win=71552 Len=0 TSval=1826898961 TSecr=2273622861"
"39","0.044143","172.18.0.3","172.18.0.2","TCP","2968","54642  >  5000 [PSH, ACK] Seq=43193 Ack=1 Win=64256 Len=2896 TSval=2273622871 TSecr=1826898961"
"40","0.044150","172.18.0.3","172.18.0.2","TCP","2968","54642  >  5000 [PSH, ACK] Seq=46089 Ack=1 Win=64256 Len=2896 TSval=2273622871 TSecr=1826898961"
"41","0.044151","172.18.0.3","172.18.0.2","TCP","4416","54642  >  5000 [PSH, ACK] Seq=48985 Ack=1 Win=64256 Len=4344 TSval=2273622871 TSecr=1826898961"
"42","0.044159","172.18.0.3","172.18.0.2","RSL","4416","PRE-HANDOver NOTIFication "
"43","0.044161","172.18.0.3","172.18.0.2","TCP","2968","54642  >  5000 [PSH, ACK] Seq=57673 Ack=1 Win=64256 Len=2896 TSval=2273622871 TSecr=1826898961"
"44","0.044167","172.18.0.3","172.18.0.2","RSL","5864","ip.access DLCX ACK "
"45","0.044375","172.18.0.2","172.18.0.3","TCP","72","5000  >  54642 [ACK] Seq=1 Ack=46089 Win=97024 Len=0 TSval=1826898971 TSecr=2273622871"
"46","0.044398","172.18.0.3","172.18.0.2","TCP","5864","54642  >  5000 [PSH, ACK] Seq=66361 Ack=1 Win=64256 Len=5792 TSval=2273622871 TSecr=1826898961"
"47","0.044400","172.18.0.3","172.18.0.2","TCP","5864","54642  >  5000 [PSH, ACK] Seq=72153 Ack=1 Win=64256 Len=5792 TSval=2273622871 TSecr=1826898961"
"48","0.044402","172.18.0.3","172.18.0.2","TCP","5864","54642  >  5000 [PSH, ACK] Seq=77945 Ack=1 Win=64256 Len=5792 TSval=2273622871 TSecr=1826898961"
"49","0.044404","172.18.0.3","172.18.0.2","TCP","5864","54642  >  5000 [PSH, ACK] Seq=83737 Ack=1 Win=64256 Len=5792 TSval=2273622871 TSecr=1826898961"
"50","0.044407","172.18.0.3","172.18.0.2","TCP","5864","54642  >  5000 [PSH, ACK] Seq=89529 Ack=1 Win=64256 Len=5792 TSval=2273622871 TSecr=1826898961"
"51","0.044409","172.18.0.3","172.18.0.2","RSL","5864","unknown 107 "
"52","0.044414","172.18.0.2","172.18.0.3","TCP","72","5000  >  54642 [ACK] Seq=1 Ack=48985 Win=94208 Len=0 TSval=1826898972 TSecr=2273622871"
"53","0.044425","172.18.0.2","172.18.0.3","TCP","72","5000  >  54642 [ACK] Seq=1 Ack=53329 Win=90112 Len=0 TSval=1826898972 TSecr=2273622871"
"54","0.044434","172.18.0.2","172.18.0.3","TCP","72","5000  >  54642 [ACK] Seq=1 Ack=57673 Win=86144 Len=0 TSval=1826898972 TSecr=2273622871"
"55","0.044445","172.18.0.2","172.18.0.3","TCP","72","5000  >  54642 [ACK] Seq=1 Ack=60569 Win=83328 Len=0 TSval=1826898972 TSecr=2273622871"
"56","0.044454","172.18.0.2","172.18.0.3","TCP","72","5000  >  54642 [ACK] Seq=1 Ack=66361 Win=78208 Len=0 TSval=1826898972 TSecr=2273622871"
"57","0.044550","172.18.0.2","172.18.0.3","TCP","72","5000  >  54642 [ACK] Seq=1 Ack=72153 Win=108544 Len=0 TSval=1826898972 TSecr=2273622871"
"58","0.044594","172.18.0.2","172.18.0.3","TCP","72","5000  >  54642 [ACK] Seq=1 Ack=77945 Win=120192 Len=0 TSval=1826898972 TSecr=2273622871"
"59","0.044654","172.18.0.2","172.18.0.3","TCP","72","5000  >  54642 [ACK] Seq=1 Ack=83737 Win=131712 Len=0 TSval=1826898972 TSecr=2273622871"
"60","0.044686","172.18.0.2","172.18.0.3","TCP","72","5000  >  54642 [ACK] Seq=1 Ack=89529 Win=142080 Len=0 TSval=1826898972 TSecr=2273622871"
"61","0.044760","172.18.0.2","172.18.0.3","TCP","72","5000  >  54642 [ACK] Seq=1 Ack=101113 Win=142080 Len=0 TSval=1826898972 TSecr=2273622871"
"62","0.054444","172.18.0.3","172.18.0.2","TCP","5864","54642  >  5000 [PSH, ACK] Seq=101113 Ack=1 Win=64256 Len=5792 TSval=2273622882 TSecr=1826898971"
"63","0.054452","172.18.0.3","172.18.0.2","RSL","5864","CHANnel ACTIVation ACKnowledge "
"64","0.054466","172.18.0.3","172.18.0.2","TCP","8760","54642  >  5000 [PSH, ACK] Seq=112697 Ack=1 Win=64256 Len=8688 TSval=2273622882 TSecr=1826898972"
"65","0.054472","172.18.0.3","172.18.0.2","TCP","13104","54642  >  5000 [PSH, ACK] Seq=121385 Ack=1 Win=64256 Len=13032 TSval=2273622882 TSecr=1826898972"
"66","0.054712","172.18.0.2","172.18.0.3","TCP","72","5000  >  54642 [ACK] Seq=1 Ack=106905 Win=153600 Len=0 TSval=1826898982 TSecr=2273622882"
"67","0.054727","172.18.0.2","172.18.0.3","TCP","72","5000  >  54642 [ACK] Seq=1 Ack=134417 Win=201728 Len=0 TSval=1826898982 TSecr=2273622882"
"68","0.054749","172.18.0.3","172.18.0.2","TCP","14552","54642  >  5000 [PSH, ACK] Seq=134417 Ack=1 Win=64256 Len=14480 TSval=2273622882 TSecr=1826898972"
"69","0.054755","172.18.0.3","172.18.0.2","TCP","16000","54642  >  5000 [PSH, ACK] Seq=148897 Ack=1 Win=64256 Len=15928 TSval=2273622882 TSecr=1826898972"
"70","0.054758","172.18.0.3","172.18.0.2","TCP","5864","54642  >  5000 [PSH, ACK] Seq=164825 Ack=1 Win=64256 Len=5792 TSval=2273622882 TSecr=1826898972"
"71","0.054764","172.18.0.3","172.18.0.2","TCP","18896","54642  >  5000 [PSH, ACK] Seq=170617 Ack=1 Win=64256 Len=18824 TSval=2273622882 TSecr=1826898972"
"72","0.054769","172.18.0.2","172.18.0.3","TCP","72","5000  >  54642 [ACK] Seq=1 Ack=112697 Win=165248 Len=0 TSval=1826898982 TSecr=2273622882"
"73","0.054803","172.18.0.3","172.18.0.2","TCP","20344","54642  >  5000 [PSH, ACK] Seq=189441 Ack=1 Win=64256 Len=20272 TSval=2273622882 TSecr=1826898972"
"74","0.054812","172.18.0.2","172.18.0.3","TCP","72","5000  >  54642 [ACK] Seq=1 Ack=121385 Win=175744 Len=0 TSval=1826898982 TSecr=2273622882"
"75","0.054833","172.18.0.2","172.18.0.3","TCP","84","5000  >  54642 [ACK] Seq=1 Ack=134417 Win=242304 Len=0 TSval=1826898982 TSecr=2273622882 SLE=189441 SRE=209713"
"76","0.055818","172.18.0.3","172.18.0.2","RSL","7312","unknown 92 "
"77","0.055928","172.18.0.2","172.18.0.3","TCP","84","5000  >  54642 [ACK] Seq=1 Ack=148897 Win=271232 Len=0 TSval=1826898983 TSecr=2273622882 SLE=189441 SRE=209713"
"78","0.055969","172.18.0.2","172.18.0.3","TCP","84","5000  >  54642 [ACK] Seq=1 Ack=164825 Win=291072 Len=0 TSval=1826898983 TSecr=2273622882 SLE=189441 SRE=209713"
"79","0.056004","172.18.0.2","172.18.0.3","TCP","84","5000  >  54642 [ACK] Seq=1 Ack=170617 Win=286592 Len=0 TSval=1826898983 TSecr=2273622882 SLE=189441 SRE=209713"
"80","0.056030","172.18.0.2","172.18.0.3","TCP","72","5000  >  54642 [ACK] Seq=1 Ack=209713 Win=273024 Len=0 TSval=1826898983 TSecr=2273622882"
"81","0.056092","172.18.0.2","172.18.0.3","TCP","72","5000  >  54642 [ACK] Seq=1 Ack=216953 Win=291072 Len=0 TSval=1826898983 TSecr=2273622882"
"82","0.064801","172.18.0.3","172.18.0.2","RSL","11656","Round Trip Delay REPort "
"83","0.064820","172.18.0.3","172.18.0.2","TCP","1520","54642  >  5000 [ACK] Seq=228537 Ack=1 Win=64256 Len=1448 TSval=2273622892 TSecr=1826898982"
"84","0.064869","172.18.0.3","172.18.0.2","TCP","26136","54642  >  5000 [PSH, ACK] Seq=229985 Ack=1 Win=64256 Len=26064 TSval=2273622892 TSecr=1826898982"
"85","0.064882","172.18.0.3","172.18.0.2","TCP","26136","54642  >  5000 [PSH, ACK] Seq=256049 Ack=1 Win=64256 Len=26064 TSval=2273622892 TSecr=1826898982"
"86","0.065123","172.18.0.2","172.18.0.3","TCP","72","5000  >  54642 [ACK] Seq=1 Ack=228537 Win=314240 Len=0 TSval=1826898992 TSecr=2273622892"
"87","0.065131","172.18.0.2","172.18.0.3","TCP","72","5000  >  54642 [ACK] Seq=1 Ack=229985 Win=317056 Len=0 TSval=1826898992 TSecr=2273622892"
"88","0.065180","172.18.0.2","172.18.0.3","TCP","72","5000  >  54642 [ACK] Seq=1 Ack=256049 Win=369280 Len=0 TSval=1826898992 TSecr=2273622892"
"89","0.065218","172.18.0.2","172.18.0.3","TCP","72","5000  >  54642 [ACK] Seq=1 Ack=282113 Win=421376 Len=0 TSval=1826898992 TSecr=2273622892"
"90","0.065892","172.18.0.3","172.18.0.2","TCP","14552","[TCP Spurious Retransmission] 54642  >  5000 [PSH, ACK] Seq=134417 Ack=1 Win=64256 Len=14480 TSval=2273622892 TSecr=1826898982"
"91","0.065901","172.18.0.3","172.18.0.2","TCP","5864","[TCP Spurious Retransmission] 54642  >  5000 [PSH, ACK] Seq=148897 Ack=1 Win=64256 Len=5792 TSval=2273622892 TSecr=1826898982"
"92","0.066038","172.18.0.2","172.18.0.3","TCP","84","[TCP Dup ACK 89#1] 5000  >  54642 [ACK] Seq=1 Ack=282113 Win=421376 Len=0 TSval=1826898993 TSecr=2273622892 SLE=134417 SRE=148897"
"93","0.066056","172.18.0.2","172.18.0.3","TCP","84","[TCP Dup ACK 89#2] 5000  >  54642 [ACK] Seq=1 Ack=282113 Win=421376 Len=0 TSval=1826898993 TSecr=2273622892 SLE=148897 SRE=154689"
"94","0.066076","172.18.0.3","172.18.0.2","TCP","13104","54642  >  5000 [PSH, ACK] Seq=282113 Ack=1 Win=64256 Len=13032 TSval=2273622893 TSecr=1826898983"
"95","0.066079","172.18.0.3","172.18.0.2","TCP","2968","54642  >  5000 [PSH, ACK] Seq=295145 Ack=1 Win=64256 Len=2896 TSval=2273622893 TSecr=1826898983"
"96","0.066087","172.18.0.3","172.18.0.2","TCP","29032","54642  >  5000 [PSH, ACK] Seq=298041 Ack=1 Win=64256 Len=28960 TSval=2273622893 TSecr=1826898983"
"97","0.066096","172.18.0.3","172.18.0.2","TCP","30480","54642  >  5000 [PSH, ACK] Seq=327001 Ack=1 Win=64256 Len=30408 TSval=2273622893 TSecr=1826898983"
"98","0.066098","172.18.0.3","172.18.0.2","TCP","2968","54642  >  5000 [PSH, ACK] Seq=357409 Ack=1 Win=64256 Len=2896 TSval=2273622893 TSecr=1826898983"
"99","0.066116","172.18.0.3","172.18.0.2","TCP","33376","54642  >  5000 [PSH, ACK] Seq=360305 Ack=1 Win=64256 Len=33304 TSval=2273622893 TSecr=1826898983"
"100","0.066123","172.18.0.3","172.18.0.2","TCP","20344","54642  >  5000 [PSH, ACK] Seq=393609 Ack=1 Win=64256 Len=20272 TSval=2273622893 TSecr=1826898983"
"101","0.066319","172.18.0.2","172.18.0.3","TCP","72","5000  >  54642 [ACK] Seq=1 Ack=295145 Win=447488 Len=0 TSval=1826898993 TSecr=2273622893"
"102","0.066345","172.18.0.2","172.18.0.3","TCP","72","5000  >  54642 [ACK] Seq=1 Ack=298041 Win=453248 Len=0 TSval=1826898993 TSecr=2273622893"
"103","0.066353","172.18.0.2","172.18.0.3","TCP","72","5000  >  54642 [ACK] Seq=1 Ack=327001 Win=511104 Len=0 TSval=1826898993 TSecr=2273622893"
"104","0.066371","172.18.0.2","172.18.0.3","TCP","72","5000  >  54642 [ACK] Seq=1 Ack=357409 Win=571904 Len=0 TSval=1826898993 TSecr=2273622893"
"105","0.066387","172.18.0.2","172.18.0.3","TCP","72","5000  >  54642 [ACK] Seq=1 Ack=360305 Win=577792 Len=0 TSval=1826898993 TSecr=2273622893"
"106","0.066393","172.18.0.2","172.18.0.3","TCP","72","5000  >  54642 [ACK] Seq=1 Ack=393609 Win=617472 Len=0 TSval=1826898993 TSecr=2273622893"
"107","0.066404","172.18.0.2","172.18.0.3","TCP","72","5000  >  54642 [ACK] Seq=1 Ack=413881 Win=602112 Len=0 TSval=1826898993 TSecr=2273622893"
"108","0.075179","172.18.0.3","172.18.0.2","TCP","11656","54642  >  5000 [PSH, ACK] Seq=413881 Ack=1 Win=64256 Len=11584 TSval=2273622902 TSecr=1826898992"
"109","0.075323","172.18.0.2","172.18.0.3","TCP","72","5000  >  54642 [ACK] Seq=1 Ack=425465 Win=640640 Len=0 TSval=1826899002 TSecr=2273622902"
"110","0.075359","172.18.0.3","172.18.0.2","TCP","42064","54642  >  5000 [PSH, ACK] Seq=425465 Ack=1 Win=64256 Len=41992 TSval=2273622902 TSecr=1826898992"
"111","0.075366","172.18.0.3","172.18.0.2","TCP","23240","54642  >  5000 [PSH, ACK] Seq=467457 Ack=1 Win=64256 Len=23168 TSval=2273622902 TSecr=1826898992"
"112","0.075378","172.18.0.3","172.18.0.2","TCP","47856","54642  >  5000 [PSH, ACK] Seq=490625 Ack=1 Win=64256 Len=47784 TSval=2273622902 TSecr=1826898992"
"113","0.075380","172.18.0.3","172.18.0.2","TCP","5864","54642  >  5000 [PSH, ACK] Seq=538409 Ack=1 Win=64256 Len=5792 TSval=2273622902 TSecr=1826898992"
"114","0.075452","172.18.0.2","172.18.0.3","TCP","72","5000  >  54642 [ACK] Seq=1 Ack=467457 Win=724608 Len=0 TSval=1826899003 TSecr=2273622902"
"115","0.075463","172.18.0.2","172.18.0.3","TCP","72","5000  >  54642 [ACK] Seq=1 Ack=490625 Win=770944 Len=0 TSval=1826899003 TSecr=2273622902"
"116","0.075471","172.18.0.2","172.18.0.3","TCP","72","5000  >  54642 [ACK] Seq=1 Ack=538409 Win=866560 Len=0 TSval=1826899003 TSecr=2273622902"
"117","0.075482","172.18.0.2","172.18.0.3","TCP","72","5000  >  54642 [ACK] Seq=1 Ack=544201 Win=878080 Len=0 TSval=1826899003 TSecr=2273622902"
"118","0.076389","172.18.0.3","172.18.0.2","TCP","11656","54642  >  5000 [PSH, ACK] Seq=544201 Ack=1 Win=64256 Len=11584 TSval=2273622904 TSecr=1826898993"
"119","0.076413","172.18.0.3","172.18.0.2","TCP","56544","54642  >  5000 [PSH, ACK] Seq=555785 Ack=1 Win=64256 Len=56472 TSval=2273622904 TSecr=1826898993"
"120","0.076416","172.18.0.3","172.18.0.2","TCP","8760","54642  >  5000 [PSH, ACK] Seq=612257 Ack=1 Win=64256 Len=8688 TSval=2273622904 TSecr=1826898993"
"121","0.076428","172.18.0.3","172.18.0.2","TCP","62336","54642  >  5000 [PSH, ACK] Seq=620945 Ack=1 Win=64256 Len=62264 TSval=2273622904 TSecr=1826898993"
"122","0.076430","172.18.0.3","172.18.0.2","TCP","2968","54642  >  5000 [PSH, ACK] Seq=683209 Ack=1 Win=64256 Len=2896 TSval=2273622904 TSecr=1826898993"
"123","0.076447","172.18.0.3","172.18.0.2","TCP","65232","54642  >  5000 [PSH, ACK] Seq=686105 Ack=1 Win=64256 Len=65160 TSval=2273622904 TSecr=1826898993"
"124","0.076460","172.18.0.3","172.18.0.2","TCP","56544","54642  >  5000 [PSH, ACK] Seq=751265 Ack=1 Win=64256 Len=56472 TSval=2273622904 TSecr=1826898993"
"125","0.076653","172.18.0.2","172.18.0.3","TCP","72","5000  >  54642 [ACK] Seq=1 Ack=555785 Win=892160 Len=0 TSval=1826899004 TSecr=2273622904"
"126","0.076668","172.18.0.2","172.18.0.3","TCP","72","5000  >  54642 [ACK] Seq=1 Ack=612257 Win=849152 Len=0 TSval=1826899004 TSecr=2273622904"
"127","0.076674","172.18.0.2","172.18.0.3","TCP","72","5000  >  54642 [ACK] Seq=1 Ack=620945 Win=842496 Len=0 TSval=1826899004 TSecr=2273622904"
"128","0.076679","172.18.0.2","172.18.0.3","TCP","72","5000  >  54642 [ACK] Seq=1 Ack=683209 Win=795136 Len=0 TSval=1826899004 TSecr=2273622904"
"129","0.076685","172.18.0.2","172.18.0.3","TCP","72","5000  >  54642 [ACK] Seq=1 Ack=686105 Win=792320 Len=0 TSval=1826899004 TSecr=2273622904"
"130","0.076689","172.18.0.2","172.18.0.3","TCP","72","5000  >  54642 [ACK] Seq=1 Ack=751265 Win=741888 Len=0 TSval=1826899004 TSecr=2273622904"
"131","0.076692","172.18.0.2","172.18.0.3","TCP","72","5000  >  54642 [ACK] Seq=1 Ack=807737 Win=698240 Len=0 TSval=1826899004 TSecr=2273622904"
"132","0.085371","172.18.0.3","172.18.0.2","TCP","8760","54642  >  5000 [PSH, ACK] Seq=807737 Ack=1 Win=64256 Len=8688 TSval=2273622913 TSecr=1826899002"
"133","0.085742","172.18.0.2","172.18.0.3","TCP","72","5000  >  54642 [ACK] Seq=1 Ack=816425 Win=909568 Len=0 TSval=1826899013 TSecr=2273622913"
"134","0.085772","172.18.0.3","172.18.0.2","RSL","65232","PREPROCessed MEASurement RESult unknown 0x67 "
"135","0.085786","172.18.0.3","172.18.0.2","RSL","65232","DATA REQuest (DTAP) (Unknown) unknown 0xde unknown 0x55 "
"136","0.085798","172.18.0.3","172.18.0.2","IPA","65232","IPA unknown 0xac unknown 0x59 "
"137","0.085806","172.18.0.3","172.18.0.2","TCP","36744","54642  >  5000 [FIN, PSH, ACK] Seq=1011905 Ack=1 Win=64256 Len=36672 TSval=2273622913 TSecr=1826899003"
"138","0.085911","172.18.0.2","172.18.0.3","TCP","72","5000  >  54642 [ACK] Seq=1 Ack=881585 Win=1039872 Len=0 TSval=1826899013 TSecr=2273622913"
"139","0.085925","172.18.0.2","172.18.0.3","TCP","72","5000  >  54642 [ACK] Seq=1 Ack=946745 Win=1170176 Len=0 TSval=1826899013 TSecr=2273622913"
"140","0.085946","172.18.0.2","172.18.0.3","TCP","72","5000  >  54642 [ACK] Seq=1 Ack=1011905 Win=1300480 Len=0 TSval=1826899013 TSecr=2273622913"
"141","0.085963","172.18.0.2","172.18.0.3","TCP","72","5000  >  54642 [ACK] Seq=1 Ack=1048578 Win=1373824 Len=0 TSval=1826899013 TSecr=2273622913"
"142","0.091703","172.18.0.2","172.18.0.3","TCP","72","5000  >  54642 [FIN, ACK] Seq=1 Ack=1048578 Win=1373824 Len=0 TSval=1826899019 TSecr=2273622913"
"143","0.101789","172.18.0.3","172.18.0.2","TCP","72","54642  >  5000 [ACK] Seq=1048578 Ack=2 Win=64256 Len=0 TSval=2273622929 TSecr=1826899019"
"144","0.756777","172.18.0.3","172.18.0.2","TCP","80","54644  >  5000 [SYN] Seq=0 Win=64240 Len=0 MSS=1460 SACK_PERM TSval=2273623584 TSecr=0 WS=128"
"145","0.756967","172.18.0.2","172.18.0.3","TCP","80","5000  >  54644 [SYN, ACK] Seq=0 Ack=1 Win=65160 Len=0 MSS=1460 SACK_PERM TSval=1826899684 TSecr=2273623584 WS=128"
"146","0.767048","172.18.0.3","172.18.0.2","TCP","72","54644  >  5000 [ACK] Seq=1 Ack=1 Win=64256 Len=0 TSval=2273623594 TSecr=1826899684"
"147","0.770376","172.18.0.3","172.18.0.2","TCP","2968","54644  >  5000 [PSH, ACK] Seq=1 Ack=1 Win=64256 Len=2896 TSval=2273623597 TSecr=1826899684"
"148","0.770384","172.18.0.3","172.18.0.2","TCP","1272","54644  >  5000 [PSH, ACK] Seq=2897 Ack=1 Win=64256 Len=1200 TSval=2273623597 TSecr=1826899684"
"149","0.770387","172.18.0.3","172.18.0.2","TCP","2968","54644  >  5000 [PSH, ACK] Seq=4097 Ack=1 Win=64256 Len=2896 TSval=2273623597 TSecr=1826899684"
"150","0.770390","172.18.0.3","172.18.0.2","TCP","2968","54644  >  5000 [PSH, ACK] Seq=6993 Ack=1 Win=64256 Len=2896 TSval=2273623597 TSecr=1826899684"
"151","0.770392","172.18.0.3","172.18.0.2","TCP","1520","54644  >  5000 [ACK] Seq=9889 Ack=1 Win=64256 Len=1448 TSval=2273623597 TSecr=1826899684"
"152","0.770395","172.18.0.3","172.18.0.2","TCP","2968","54644  >  5000 [PSH, ACK] Seq=11337 Ack=1 Win=64256 Len=2896 TSval=2273623598 TSecr=1826899684"
"153","0.770593","172.18.0.2","172.18.0.3","TCP","72","5000  >  54644 [ACK] Seq=1 Ack=2897 Win=71040 Len=0 TSval=1826899698 TSecr=2273623597"
"154","0.770622","172.18.0.2","172.18.0.3","TCP","72","5000  >  54644 [ACK] Seq=1 Ack=4097 Win=73856 Len=0 TSval=1826899698 TSecr=2273623597"
"155","0.770632","172.18.0.2","172.18.0.3","TCP","72","5000  >  54644 [ACK] Seq=1 Ack=6993 Win=79744 Len=0 TSval=1826899698 TSecr=2273623597"
"156","0.770644","172.18.0.2","172.18.0.3","TCP","72","5000  >  54644 [ACK] Seq=1 Ack=9889 Win=85504 Len=0 TSval=1826899698 TSecr=2273623597"
"157","0.770654","172.18.0.2","172.18.0.3","TCP","72","5000  >  54644 [ACK] Seq=1 Ack=11337 Win=87808 Len=0 TSval=1826899698 TSecr=2273623597"
"158","0.770663","172.18.0.2","172.18.0.3","TCP","72","5000  >  54644 [ACK] Seq=1 Ack=14233 Win=84992 Len=0 TSval=1826899698 TSecr=2273623598"
"159","0.780650","172.18.0.3","172.18.0.2","TCP","2968","54644  >  5000 [PSH, ACK] Seq=14233 Ack=1 Win=64256 Len=2896 TSval=2273623608 TSecr=1826899698"
"160","0.780656","172.18.0.3","172.18.0.2","TCP","2968","54644  >  5000 [PSH, ACK] Seq=17129 Ack=1 Win=64256 Len=2896 TSval=2273623608 TSecr=1826899698"
"161","0.780659","172.18.0.3","172.18.0.2","TCP","2968","54644  >  5000 [PSH, ACK] Seq=20025 Ack=1 Win=64256 Len=2896 TSval=2273623608 TSecr=1826899698"
"162","0.780666","172.18.0.3","172.18.0.2","TCP","2968","54644  >  5000 [PSH, ACK] Seq=22921 Ack=1 Win=64256 Len=2896 TSval=2273623608 TSecr=1826899698"
"163","0.780668","172.18.0.3","172.18.0.2","TCP","2968","54644  >  5000 [PSH, ACK] Seq=25817 Ack=1 Win=64256 Len=2896 TSval=2273623608 TSecr=1826899698"
"164","0.780677","172.18.0.3","172.18.0.2","TCP","4416","54644  >  5000 [PSH, ACK] Seq=28713 Ack=1 Win=64256 Len=4344 TSval=2273623608 TSecr=1826899698"
"165","0.780680","172.18.0.3","172.18.0.2","TCP","4416","54644  >  5000 [PSH, ACK] Seq=33057 Ack=1 Win=64256 Len=4344 TSval=2273623608 TSecr=1826899698"
"166","0.780685","172.18.0.3","172.18.0.2","TCP","4416","54644  >  5000 [PSH, ACK] Seq=37401 Ack=1 Win=64256 Len=4344 TSval=2273623608 TSecr=1826899698"
"167","0.780937","172.18.0.2","172.18.0.3","TCP","72","5000  >  54644 [ACK] Seq=1 Ack=17129 Win=93696 Len=0 TSval=1826899708 TSecr=2273623608"
"168","0.780940","172.18.0.2","172.18.0.3","TCP","72","5000  >  54644 [ACK] Seq=1 Ack=25817 Win=88448 Len=0 TSval=1826899708 TSecr=2273623608"
"169","0.780968","172.18.0.3","172.18.0.2","TCP","1520","54644  >  5000 [ACK] Seq=41745 Ack=1 Win=64256 Len=1448 TSval=2273623608 TSecr=1826899698"
"170","0.780975","172.18.0.2","172.18.0.3","TCP","72","5000  >  54644 [ACK] Seq=1 Ack=20025 Win=94080 Len=0 TSval=1826899708 TSecr=2273623608"
"171","0.781017","172.18.0.2","172.18.0.3","TCP","72","5000  >  54644 [ACK] Seq=1 Ack=22921 Win=91264 Len=0 TSval=1826899708 TSecr=2273623608"
"172","0.781039","172.18.0.2","172.18.0.3","TCP","72","5000  >  54644 [ACK] Seq=1 Ack=28713 Win=85632 Len=0 TSval=1826899708 TSecr=2273623608"
"173","0.781088","172.18.0.2","172.18.0.3","TCP","72","5000  >  54644 [ACK] Seq=1 Ack=33057 Win=81408 Len=0 TSval=1826899708 TSecr=2273623608"
"174","0.781241","172.18.0.2","172.18.0.3","TCP","72","5000  >  54644 [ACK] Seq=1 Ack=37401 Win=77184 Len=0 TSval=1826899708 TSecr=2273623608"
"175","0.781302","172.18.0.2","172.18.0.3","TCP","72","5000  >  54644 [ACK] Seq=1 Ack=41745 Win=72960 Len=0 TSval=1826899708 TSecr=2273623608"
"176","0.781497","172.18.0.2","172.18.0.3","TCP","72","5000  >  54644 [ACK] Seq=1 Ack=43193 Win=71552 Len=0 TSval=1826899709 TSecr=2273623608"
"177","0.791071","172.18.0.3","172.18.0.2","TCP","2968","54644  >  5000 [PSH, ACK] Seq=43193 Ack=1 Win=64256 Len=2896 TSval=2273623618 TSecr=1826899708"
"178","0.791080","172.18.0.3","172.18.0.2","TCP","7312","54644  >  5000 [PSH, ACK] Seq=46089 Ack=1 Win=64256 Len=7240 TSval=2273623618 TSecr=1826899708"
"179","0.791083","172.18.0.3","172.18.0.2","RSL","7312","PRE-HANDOver NOTIFication "
"180","0.791125","172.18.0.3","172.18.0.2","RSL","7312","ip.access DLCX ACK "
"181","0.791138","172.18.0.3","172.18.0.2","TCP","8760","54644  >  5000 [PSH, ACK] Seq=67809 Ack=1 Win=64256 Len=8688 TSval=2273623618 TSecr=1826899708"
"182","0.791334","172.18.0.2","172.18.0.3","TCP","72","5000  >  54644 [ACK] Seq=1 Ack=46089 Win=97024 Len=0 TSval=1826899718 TSecr=2273623618"
"183","0.791344","172.18.0.2","172.18.0.3","TCP","72","5000  >  54644 [ACK] Seq=1 Ack=67809 Win=111488 Len=0 TSval=1826899719 TSecr=2273623618"
"184","0.791362","172.18.0.3","172.18.0.2","TCP","1520","54644  >  5000 [ACK] Seq=76497 Ack=1 Win=64256 Len=1448 TSval=2273623618 TSecr=1826899708"
"185","0.791365","172.18.0.3","172.18.0.2","TCP","8760","54644  >  5000 [PSH, ACK] Seq=77945 Ack=1 Win=64256 Len=8688 TSval=2273623618 TSecr=1826899708"
"186","0.791370","172.18.0.2","172.18.0.3","TCP","72","5000  >  54644 [ACK] Seq=1 Ack=53329 Win=90880 Len=0 TSval=1826899718 TSecr=2273623618"
"187","0.791450","172.18.0.3","172.18.0.2","TCP","10208","54644  >  5000 [PSH, ACK] Seq=86633 Ack=1 Win=64256 Len=10136 TSval=2273623619 TSecr=1826899708"
"188","0.791461","172.18.0.2","172.18.0.3","TCP","72","5000  >  54644 [ACK] Seq=1 Ack=60569 Win=84608 Len=0 TSval=1826899718 TSecr=2273623618"
"189","0.791491","172.18.0.2","172.18.0.3","TCP","72","5000  >  54644 [ACK] Seq=1 Ack=76497 Win=128896 Len=0 TSval=1826899719 TSecr=2273623618"
"190","0.791517","172.18.0.2","172.18.0.3","TCP","84","[TCP Dup ACK 189#1] 5000  >  54644 [ACK] Seq=1 Ack=76497 Win=128896 Len=0 TSval=1826899719 TSecr=2273623618 SLE=86633 SRE=96769"
"191","0.791540","172.18.0.3","172.18.0.2","TCP","4416","54644  >  5000 [PSH, ACK] Seq=96769 Ack=1 Win=64256 Len=4344 TSval=2273623619 TSecr=1826899709"
"192","0.791585","172.18.0.2","172.18.0.3","TCP","84","5000  >  54644 [ACK] Seq=1 Ack=77945 Win=127488 Len=0 TSval=1826899719 TSecr=2273623618 SLE=86633 SRE=96769"
"193","0.791633","172.18.0.2","172.18.0.3","TCP","72","5000  >  54644 [ACK] Seq=1 Ack=96769 Win=117504 Len=0 TSval=1826899719 TSecr=2273623618"
"194","0.791682","172.18.0.2","172.18.0.3","TCP","72","5000  >  54644 [ACK] Seq=1 Ack=101113 Win=114304 Len=0 TSval=1826899719 TSecr=2273623619"
"195","0.801413","172.18.0.3","172.18.0.2","TCP","5864","54644  >  5000 [PSH, ACK] Seq=101113 Ack=1 Win=64256 Len=5792 TSval=2273623629 TSecr=1826899718"
"196","0.801446","172.18.0.3","172.18.0.2","RSL","14552","CHANnel ACTIVation ACKnowledge "
"197","0.801465","172.18.0.3","172.18.0.2","TCP","14552","54644  >  5000 [PSH, ACK] Seq=121385 Ack=1 Win=64256 Len=14480 TSval=2273623629 TSecr=1826899719"
"198","0.801474","172.18.0.3","172.18.0.2","RSL","14552","unknown 122 "
"199","0.801728","172.18.0.2","172.18.0.3","TCP","72","5000  >  54644 [ACK] Seq=1 Ack=106905 Win=148608 Len=0 TSval=1826899729 TSecr=2273623629"
"200","0.801771","172.18.0.3","172.18.0.2","TCP","14552","54644  >  5000 [PSH, ACK] Seq=150345 Ack=1 Win=64256 Len=14480 TSval=2273623629 TSecr=1826899719"
"201","0.801773","172.18.0.3","172.18.0.2","TCP","1520","[TCP Spurious Retransmission] 54644  >  5000 [ACK] Seq=76497 Ack=1 Win=64256 Len=1448 TSval=2273623629 TSecr=1826899719"
"202","0.801774","172.18.0.2","172.18.0.3","TCP","72","5000  >  54644 [ACK] Seq=1 Ack=150345 Win=176384 Len=0 TSval=1826899729 TSecr=2273623629"
"203","0.801778","172.18.0.3","172.18.0.2","TCP","5864","[TCP Spurious Retransmission] 54644  >  5000 [PSH, ACK] Seq=77945 Ack=1 Win=64256 Len=5792 TSval=2273623629 TSecr=1826899719"
"204","0.801780","172.18.0.3","172.18.0.2","TCP","1520","54644  >  5000 [ACK] Seq=164825 Ack=1 Win=64256 Len=1448 TSval=2273623629 TSecr=1826899719"
"205","0.801788","172.18.0.3","172.18.0.2","TCP","17448","54644  >  5000 [PSH, ACK] Seq=166273 Ack=1 Win=64256 Len=17376 TSval=2273623629 TSecr=1826899719"
"206","0.801795","172.18.0.3","172.18.0.2","TCP","18896","54644  >  5000 [PSH, ACK] Seq=183649 Ack=1 Win=64256 Len=18824 TSval=2273623629 TSecr=1826899719"
"207","0.801797","172.18.0.3","172.18.0.2","RSL","2968","unknown 110 "
"208","0.801804","172.18.0.2","172.18.0.3","TCP","72","5000  >  54644 [ACK] Seq=1 Ack=121385 Win=176384 Len=0 TSval=1826899729 TSecr=2273623629"
"209","0.802006","172.18.0.2","172.18.0.3","TCP","72","5000  >  54644 [ACK] Seq=1 Ack=164825 Win=205312 Len=0 TSval=1826899729 TSecr=2273623629"
"210","0.802011","172.18.0.2","172.18.0.3","TCP","84","[TCP Dup ACK 209#1] 5000  >  54644 [ACK] Seq=1 Ack=164825 Win=205312 Len=0 TSval=1826899729 TSecr=2273623629 SLE=76497 SRE=77945"
"211","0.802043","172.18.0.2","172.18.0.3","TCP","84","[TCP Dup ACK 209#2] 5000  >  54644 [ACK] Seq=1 Ack=164825 Win=205312 Len=0 TSval=1826899729 TSecr=2273623629 SLE=77945 SRE=83737"
"212","0.802070","172.18.0.2","172.18.0.3","TCP","72","5000  >  54644 [ACK] Seq=1 Ack=166273 Win=208256 Len=0 TSval=1826899729 TSecr=2273623629"
"213","0.802119","172.18.0.2","172.18.0.3","TCP","72","5000  >  54644 [ACK] Seq=1 Ack=183649 Win=242944 Len=0 TSval=1826899729 TSecr=2273623629"
"214","0.802160","172.18.0.2","172.18.0.3","TCP","72","5000  >  54644 [ACK] Seq=1 Ack=202473 Win=280576 Len=0 TSval=1826899729 TSecr=2273623629"
"215","0.802200","172.18.0.2","172.18.0.3","TCP","72","5000  >  54644 [ACK] Seq=1 Ack=205369 Win=286464 Len=0 TSval=1826899729 TSecr=2273623629"
"216","0.811816","172.18.0.3","172.18.0.2","TCP","5864","54644  >  5000 [PSH, ACK] Seq=205369 Ack=1 Win=64256 Len=5792 TSval=2273623639 TSecr=1826899729"
"217","0.811836","172.18.0.3","172.18.0.2","RSL","27584","PHYsical CONTEXT REQuest unknown 0x39 "
"218","0.811984","172.18.0.2","172.18.0.3","TCP","72","5000  >  54644 [ACK] Seq=1 Ack=211161 Win=297984 Len=0 TSval=1826899739 TSecr=2273623639"
"219","0.812024","172.18.0.3","172.18.0.2","IPA","18896","OSMO EXT unknown 0xe3 unknown 0x80 "
"220","0.812031","172.18.0.3","172.18.0.2","TCP","27584","54644  >  5000 [PSH, ACK] Seq=257497 Ack=1 Win=64256 Len=27512 TSval=2273623639 TSecr=1826899729"
"221","0.812036","172.18.0.3","172.18.0.2","TCP","18896","54644  >  5000 [PSH, ACK] Seq=285009 Ack=1 Win=64256 Len=18824 TSval=2273623639 TSecr=1826899729"
"222","0.812042","172.18.0.2","172.18.0.3","TCP","72","5000  >  54644 [ACK] Seq=1 Ack=238673 Win=353024 Len=0 TSval=1826899739 TSecr=2273623639"
"223","0.812191","172.18.0.2","172.18.0.3","TCP","72","5000  >  54644 [ACK] Seq=1 Ack=257497 Win=390656 Len=0 TSval=1826899739 TSecr=2273623639"
"224","0.812204","172.18.0.2","172.18.0.3","TCP","72","5000  >  54644 [ACK] Seq=1 Ack=303833 Win=483328 Len=0 TSval=1826899739 TSecr=2273623639"
"225","0.812210","172.18.0.3","172.18.0.2","TCP","30480","54644  >  5000 [PSH, ACK] Seq=303833 Ack=1 Win=64256 Len=30408 TSval=2273623639 TSecr=1826899729"
"226","0.812256","172.18.0.3","172.18.0.2","TCP","33376","54644  >  5000 [PSH, ACK] Seq=334241 Ack=1 Win=64256 Len=33304 TSval=2273623639 TSecr=1826899729"
"227","0.812264","172.18.0.3","172.18.0.2","RSL","37720","Location Information "
"228","0.812269","172.18.0.3","172.18.0.2","TCP","8760","54644  >  5000 [PSH, ACK] Seq=405193 Ack=1 Win=64256 Len=8688 TSval=2273623639 TSecr=1826899729"
"229","0.812273","172.18.0.2","172.18.0.3","TCP","72","5000  >  54644 [ACK] Seq=1 Ack=285009 Win=445696 Len=0 TSval=1826899739 TSecr=2273623639"
"230","0.812362","172.18.0.2","172.18.0.3","TCP","72","5000  >  54644 [ACK] Seq=1 Ack=334241 Win=525696 Len=0 TSval=1826899740 TSecr=2273623639"
"231","0.812378","172.18.0.2","172.18.0.3","TCP","72","5000  >  54644 [ACK] Seq=1 Ack=367545 Win=500352 Len=0 TSval=1826899740 TSecr=2273623639"
"232","0.812386","172.18.0.2","172.18.0.3","TCP","72","5000  >  54644 [ACK] Seq=1 Ack=405193 Win=471680 Len=0 TSval=1826899740 TSecr=2273623639"
"233","0.812395","172.18.0.2","172.18.0.3","TCP","72","5000  >  54644 [ACK] Seq=1 Ack=413881 Win=465024 Len=0 TSval=1826899740 TSecr=2273623639"
"234","0.822095","172.18.0.3","172.18.0.2","TCP","11656","54644  >  5000 [PSH, ACK] Seq=413881 Ack=1 Win=64256 Len=11584 TSval=2273623649 TSecr=1826899739"
"235","0.822104","172.18.0.3","172.18.0.2","TCP","5864","54644  >  5000 [PSH, ACK] Seq=425465 Ack=1 Win=64256 Len=5792 TSval=2273623649 TSecr=1826899739"
"236","0.822115","172.18.0.3","172.18.0.2","TCP","44960","54644  >  5000 [PSH, ACK] Seq=431257 Ack=1 Win=64256 Len=44888 TSval=2273623649 TSecr=1826899739"
"237","0.822320","172.18.0.2","172.18.0.3","TCP","72","5000  >  54644 [ACK] Seq=1 Ack=425465 Win=548864 Len=0 TSval=1826899749 TSecr=2273623649"
"238","0.822328","172.18.0.2","172.18.0.3","TCP","72","5000  >  54644 [ACK] Seq=1 Ack=431257 Win=560384 Len=0 TSval=1826899749 TSecr=2273623649"
"239","0.822362","172.18.0.3","172.18.0.2","RSL","18896","unknown 124 "
"240","0.822382","172.18.0.3","172.18.0.2","TCP","56544","54644  >  5000 [PSH, ACK] Seq=494969 Ack=1 Win=64256 Len=56472 TSval=2273623649 TSecr=1826899739"
"241","0.822385","172.18.0.3","172.18.0.2","RSL","7312","MS POWER CONTROL "
"242","0.822387","172.18.0.3","172.18.0.2","TCP","72","[TCP Dup ACK 146#1] 54644  >  5000 [ACK] Seq=558681 Ack=1 Win=64256 Len=0 TSval=2273623649 TSecr=1826899739"
"243","0.822412","172.18.0.3","172.18.0.2","RSL","62336","MultiRate CODEC MOD ACKnowledge unknown 0x8d "
"244","0.822416","172.18.0.3","172.18.0.2","TCP","2968","54644  >  5000 [PSH, ACK] Seq=620945 Ack=1 Win=64256 Len=2896 TSval=2273623650 TSecr=1826899740"
"245","0.822431","172.18.0.3","172.18.0.2","TCP","65232","54644  >  5000 [PSH, ACK] Seq=623841 Ack=1 Win=64256 Len=65160 TSval=2273623650 TSecr=1826899740"
"246","0.822450","172.18.0.3","172.18.0.2","TCP","65232","54644  >  5000 [PSH, ACK] Seq=689001 Ack=1 Win=64256 Len=65160 TSval=2273623650 TSecr=1826899740"
"247","0.822465","172.18.0.3","172.18.0.2","RSL","65232","BCCH INFOrmation unknown 0xdc unknown 0x23 HSL Debug unknown 0x82 unknown 0x39 "
"248","0.822470","172.18.0.3","172.18.0.2","TCP","11656","54644  >  5000 [PSH, ACK] Seq=819321 Ack=1 Win=64256 Len=11584 TSval=2273623650 TSecr=1826899740"
"249","0.822579","172.18.0.2","172.18.0.3","TCP","72","5000  >  54644 [ACK] Seq=1 Ack=476145 Win=650240 Len=0 TSval=1826899750 TSecr=2273623649"
"250","0.822684","172.18.0.2","172.18.0.3","TCP","72","5000  >  54644 [ACK] Seq=1 Ack=558681 Win=815232 Len=0 TSval=1826899750 TSecr=2273623649"
"251","0.822707","172.18.0.2","172.18.0.3","TCP","72","5000  >  54644 [ACK] Seq=1 Ack=494969 Win=687872 Len=0 TSval=1826899750 TSecr=2273623649"
"252","0.822713","172.18.0.2","172.18.0.3","TCP","72","5000  >  54644 [ACK] Seq=1 Ack=551441 Win=800768 Len=0 TSval=1826899750 TSecr=2273623649"
"253","0.822730","172.18.0.2","172.18.0.3","TCP","72","5000  >  54644 [ACK] Seq=1 Ack=620945 Win=939776 Len=0 TSval=1826899750 TSecr=2273623650"
"254","0.822766","172.18.0.2","172.18.0.3","TCP","72","5000  >  54644 [ACK] Seq=1 Ack=623841 Win=941056 Len=0 TSval=1826899750 TSecr=2273623650"
"255","0.822799","172.18.0.2","172.18.0.3","TCP","72","5000  >  54644 [ACK] Seq=1 Ack=689001 Win=891392 Len=0 TSval=1826899750 TSecr=2273623650"
"256","0.822825","172.18.0.2","172.18.0.3","TCP","72","5000  >  54644 [ACK] Seq=1 Ack=754161 Win=841088 Len=0 TSval=1826899750 TSecr=2273623650"
"257","0.822850","172.18.0.2","172.18.0.3","TCP","72","5000  >  54644 [ACK] Seq=1 Ack=819321 Win=791424 Len=0 TSval=1826899750 TSecr=2273623650"
"258","0.822876","172.18.0.2","172.18.0.3","TCP","72","5000  >  54644 [ACK] Seq=1 Ack=830905 Win=782592 Len=0 TSval=1826899750 TSecr=2273623650"
"259","0.832401","172.18.0.3","172.18.0.2","TCP","23240","54644  >  5000 [PSH, ACK] Seq=830905 Ack=1 Win=64256 Len=23168 TSval=2273623660 TSecr=1826899749"
"260","0.832485","172.18.0.2","172.18.0.3","TCP","72","5000  >  54644 [ACK] Seq=1 Ack=854073 Win=987392 Len=0 TSval=1826899760 TSecr=2273623660"
"261","0.832646","172.18.0.3","172.18.0.2","TCP","30480","54644  >  5000 [PSH, ACK] Seq=854073 Ack=1 Win=64256 Len=30408 TSval=2273623660 TSecr=1826899750"
"262","0.832658","172.18.0.3","172.18.0.2","TCP","65232","54644  >  5000 [PSH, ACK] Seq=884481 Ack=1 Win=64256 Len=65160 TSval=2273623660 TSecr=1826899750"
"263","0.832720","172.18.0.2","172.18.0.3","TCP","72","5000  >  54644 [ACK] Seq=1 Ack=884481 Win=1048192 Len=0 TSval=1826899760 TSecr=2273623660"
"264","0.832727","172.18.0.2","172.18.0.3","TCP","72","5000  >  54644 [ACK] Seq=1 Ack=949641 Win=1178496 Len=0 TSval=1826899760 TSecr=2273623660"
"265","0.832749","172.18.0.3","172.18.0.2","TCP","65232","54644  >  5000 [PSH, ACK] Seq=949641 Ack=1 Win=64256 Len=65160 TSval=2273623660 TSecr=1826899750"
"266","0.832756","172.18.0.3","172.18.0.2","TCP","33848","54644  >  5000 [FIN, PSH, ACK] Seq=1014801 Ack=1 Win=64256 Len=33776 TSval=2273623660 TSecr=1826899750"
"267","0.832787","172.18.0.2","172.18.0.3","TCP","72","5000  >  54644 [ACK] Seq=1 Ack=1014801 Win=1308800 Len=0 TSval=1826899760 TSecr=2273623660"
"268","0.832809","172.18.0.2","172.18.0.3","TCP","72","5000  >  54644 [ACK] Seq=1 Ack=1048578 Win=1376384 Len=0 TSval=1826899760 TSecr=2273623660"
"269","0.838056","172.18.0.2","172.18.0.3","TCP","72","5000  >  54644 [FIN, ACK] Seq=1 Ack=1048578 Win=1376384 Len=0 TSval=1826899765 TSecr=2273623660"
"270","0.848135","172.18.0.3","172.18.0.2","TCP","72","54644  >  5000 [ACK] Seq=1048578 Ack=2 Win=64256 Len=0 TSval=2273623675 TSecr=1826899765"
"271","1.476805","172.18.0.3","172.18.0.2","TCP","80","54658  >  5000 [SYN] Seq=0 Win=64240 Len=0 MSS=1460 SACK_PERM TSval=2273624304 TSecr=0 WS=128"
"272","1.476980","172.18.0.2","172.18.0.3","TCP","80","5000  >  54658 [SYN, ACK] Seq=0 Ack=1 Win=65160 Len=0 MSS=1460 SACK_PERM TSval=1826900404 TSecr=2273624304 WS=128"
"273","1.487074","172.18.0.3","172.18.0.2","TCP","72","54658  >  5000 [ACK] Seq=1 Ack=1 Win=64256 Len=0 TSval=2273624314 TSecr=1826900404"
"274","1.490623","172.18.0.3","172.18.0.2","TCP","2968","54658  >  5000 [PSH, ACK] Seq=1 Ack=1 Win=64256 Len=2896 TSval=2273624318 TSecr=1826900404"
"275","1.490631","172.18.0.3","172.18.0.2","TCP","1272","54658  >  5000 [PSH, ACK] Seq=2897 Ack=1 Win=64256 Len=1200 TSval=2273624318 TSecr=1826900404"
